teacher_id,item_name,item_year,item_type,journal,journal_type,co_worker_in,co_worker_out,scholarship_type,equis
306007.0,A Model on Energy Power Management of Air-Recirculation in a Clean Room,2021,會議論文,,X,,"Liu, Fu-Han;Woo-Tsong Lin",Basic_or_Discovery_Scholarship,E4:Papers in Academic conferences
306007.0,「供應鏈動態能力與供應鏈復原力在促進供應鏈績效所扮演之角色」科技部計畫成果報告,2020,研究報告,,X,,林我聰,Basic_or_Discovery_Scholarship,E12:Studies and Reports produced as part of an int'l network
306007.0,A Multi-Objective Optimal Decision Model for a Green Closed-Loop Supply Chain under Uncertainty: A Real Industrial Case Study,2021,期刊論文,Advances in Production Engineering & Management,X,,"Fang, I-Wen;Woo-Tsong Lin",Basic_or_Discovery_Scholarship,E1:Academic Research Articles
107022.0,Time-varying Transitional Dynamics of Macroeconomic Determinants on Carry Trade,2022,期刊論文,經濟研究,O,,Chien-Hsiu Lin;Chih-Nan Chen,Basic_or_Discovery_Scholarship,E1:Academic Research Articles
127364.0,Corruption Transfer and Acquisition Performance,2022,期刊論文,Journal of Banking & Finance,O,,黃嘉威;Chih-Yen Lin;Wen-Chun Lin;Yun-Ching Tsai,Basic_or_Discovery_Scholarship,E1:Academic Research Articles
127364.0,Board Corruption and Loan Contracts,2022,期刊論文,Journal of Business Finance & Accounting,O,,Robin Robin;黃嘉威;Chih-Yung Lin,Basic_or_Discovery_Scholarship,E1:Academic Research Articles
117067.0,Group-level information decay and inventory inspection: An empirical-analytical approach,2022,期刊論文,Journal of Operations Management,O,,莊皓鈞;Rogelio Oliva;Subodha Kumar,Basic_or_Discovery_Scholarship,E1:Academic Research Articles
118658.0,Corporate growth and strategic payout policy,2022,期刊論文,Review of Quantitative Finance and Accounting,X,,Bai-Sian Chen;Hong-Yi Chen;Hsiao-Yin Chen;Fang-Chi Lin,Basic_or_Discovery_Scholarship,E1:Academic Research Articles
123260.0,A Machine Learning Approach to Model HRI Research Trends in 2010~2021,2022,會議論文,,X,,Chan Hsu;Ching-Chih Tsao;Yu-Liang Weng;Cheng-Yi Tang;Yu-Wen Chang;Yihuang Kang;簡士鎰,Basic_or_Discovery_Scholarship,E4:Papers in Academic conferences
118732.0,A Virtual Multi-label Approach to Imbalanced Data Classification,2022,期刊論文,Communications in Statistics - Simulation and Computation,X,,Elizabeth Chou;Shan-Ping Yang,Basic_or_Discovery_Scholarship,E1:Academic Research Articles
125494.0,The causal effect of subscription video streaming on DVD sales: Evidence from a natural experiment,2022,期刊論文,Decision Support Systems,X,,Yinan Yu;Hailiang Chen;Chih-Hung Peng;Patrick Chau,Basic_or_Discovery_Scholarship,E1:Academic Research Articles
123260.0,XFlag: Explainable Fake News Detection Model on Social Media,2022,期刊論文,International Journal of Human-Computer Interaction,O,,簡士鎰;Cheng-Jun Yang;Fang Yu,Basic_or_Discovery_Scholarship,E1:Academic Research Articles
128655.0,Sufficient dimension reduction for survival data analysis with error-prone variables,2022,期刊論文,Electronic Journal of Statistics,X,,Li-Pang Chen;Grace Yi,Basic_or_Discovery_Scholarship,E1:Academic Research Articles
128655.0,Monitoring process location and dispersion simultaneously using a control region,2022,期刊論文,DYNA,X,,Li-Pang Chen;Syamsiyatul Muzayyanah;Su-Fen Yang;Bin Wang;Ting-An Jiang;Shengjin Gan,Basic_or_Discovery_Scholarship,E1:Academic Research Articles
128655.0,Supervised learning for binary classification on US adult income,2021,期刊論文,Journal of Modeling and Optimization,X,,陳立榜,Basic_or_Discovery_Scholarship,E1:Academic Research Articles
128655.0,The ESD Control Program Handbook,2022,期刊論文,Technometrics,X,,Li-Pang Chen,Basic_or_Discovery_Scholarship,E1:Academic Research Articles
128655.0,Introduction to data science: Data analysis and prediction algorithms with R,2022,期刊論文,"Journal of the Royal Statistical Society, Series A",X,,陳立榜,Basic_or_Discovery_Scholarship,E1:Academic Research Articles
102048.0,A Novel Trading Strategy Framework Based on Reinforcement Deep Learning for Financial Market Predictions,2021,期刊論文,Mathematics,O,,Ming-hua Hsieh;Li-Chen Cheng;Yu-Hsiang Huang;Mu-En Wu,Basic_or_Discovery_Scholarship,E1:Academic Research Articles
121807.0,A mixed-methods approach to identifying and exploring the causes of the electronic service gap between hospital website developers and users,2022,期刊論文,Technology Analysis & Strategic Management,O,,Wei-Hsi Hung;Chih-Lang Tseng;Fang-Kai Chang;Yi-Che Wu,Basic_or_Discovery_Scholarship,E1:Academic Research Articles
354008.0,Comparing Nonparametric Estimators for the Number of Shared Species in Two Populations,2022,期刊論文,Diversity,X,,余清祥;Murray K. Clayton;洪志叡,Basic_or_Discovery_Scholarship,E1:Academic Research Articles
125916.0,普祺樂實業有限公司—從業務思維到共贏策略,2021,會議論文,,O,,田耕銘;王倩逸;張深閔;黃政仁,Basic_or_Discovery_Scholarship,E4:Papers in Academic conferences
121807.0,An integrated model of supply chain resilience and its impact chain performance under disruption,2021,期刊論文,The International Journal of Logistics Management,O,,Wei-Hsi Hung;Shih-Jung Juan;Eldon Y. Li,Basic_or_Discovery_Scholarship,E1:Academic Research Articles
121807.0,A low-cost intelligent tracking system for clothing manufacturers,2021,期刊論文,Journal of Intelligent Manufacturing,X,,Wei-Hsi Hung;Yen Sheng Tsai,Basic_or_Discovery_Scholarship,E1:Academic Research Articles
121807.0,The effect of Airbnb and business cycle on the price elasticity of demand in the hotel industry,2021,期刊論文,Current Issues in Tourism,O,,Wei-Hsi Hung;Chiang-Ming Chen;Yu-Chen Lin;Chia-Yu Jih,Basic_or_Discovery_Scholarship,E1:Academic Research Articles
128824.0,Bayesian estimation for an item response tree model for nonresponse modeling,2022,期刊論文,Metrika,X,,Yu-Wei Chang;Jyun-Ye Tu,Basic_or_Discovery_Scholarship,E1:Academic Research Articles
354005.0,Modeling industrial energy demand in relation to sub-sector manufacturing output and climate change: artificial neural network insights,2022,期刊論文,Sustainability,O,,"Shiau,Y;Yang, S;Adha, A;Syamsiyatul , M",Basic_or_Discovery_Scholarship,E1:Academic Research Articles
128655.0,Ultrahigh-dimensional sufficient dimension reduction for censored data with covariates measurement error,2022,期刊論文,Journal of Applied Statistics,X,,Li-Pang Chen,Basic_or_Discovery_Scholarship,E1:Academic Research Articles
103897.0,內外兼俱，雙管齊下：探討內部人力資源發展活動與外部顧客經營活動對研發主管職能之影響,2022,期刊論文,人力資源管理學報,O,,黃櫻美;蔡維奇;林隆偉,Basic_or_Discovery_Scholarship,E1:Academic Research Articles
102064.0,永續轉型歷程中創新類型與社會科技體制的互動與變遷─以丹麥能源轉型與風機產業為例,2021,會議論文,,X,,王政憲;許牧彥;柯玉佳,Basic_or_Discovery_Scholarship,E4:Papers in Academic conferences
102064.0,"Firm heterogeneity, appropriability, and innovation collaboration",2020,期刊論文,TECHNOLOGY ANALYSIS & STRATEGIC MANAGEMENT,O,,Ming-Jen Yu;Hao-Jun Chuang;Mu-Yen Hsu;Peng-Fei Lin,Basic_or_Discovery_Scholarship,E1:Academic Research Articles
102064.0,供應商對其潛在客戶發動專利訴訟之影響因素─以動態競合的觀點分析,2020,會議論文,,X,,楊翰;許牧彥,Basic_or_Discovery_Scholarship,E4:Papers in Academic conferences
128655.0,Quality control under nonparametric bivariate location and dispersion processes,2021,會議論文,,X,,Li-Pang Chen;Su-Fen Yang;Ting-An Jiang,Basic_or_Discovery_Scholarship,E4:Papers in Academic conferences
128655.0,Network based discriminant analysis for multiclassification,2021,會議論文,,X,,Li-Pang Chen,Basic_or_Discovery_Scholarship,E4:Papers in Academic conferences
128655.0,Analysis of noisy survival data with graphical proportional hazards measurement error models,2021,期刊論文,Biometrics,X,,Li-Pang Chen;Grace Yi,Basic_or_Discovery_Scholarship,E1:Academic Research Articles
128655.0,Statistical learning for analysis of credit risk data,2021,期刊論文,IOSR Journal of Mathematics,X,,Li-Pang Chen,Basic_or_Discovery_Scholarship,E1:Academic Research Articles
128655.0,Semiparametric methods for left-truncated and right-censored survival data  with covariate measurement error,2021,期刊論文,Annals of the Institute of Statistical Mathematics,X,,Li-Pang Chen;Grace Yi,Basic_or_Discovery_Scholarship,E1:Academic Research Articles
128655.0,Model-based forecasting for Canadian COVID-19 data,2021,期刊論文,PLOS ONE,X,,Li-Pang Chen;Qihuang Zhang;Grace Yi;Wenqing He,Basic_or_Discovery_Scholarship,E1:Academic Research Articles
128655.0,"Statistical Foundations of Data Science Jianqing Fan, Runze Li, Cun-Hui Zhang and Hui Zou",2021,期刊論文,Biometrics,X,,Li-Pang Chen,Basic_or_Discovery_Scholarship,E1:Academic Research Articles
128655.0,Practical Statistics for Data Scientists: 50+ Essential Concepts Using R and Python,2022,期刊論文,Technometrics,X,,Li-Pang Chen,Basic_or_Discovery_Scholarship,E1:Academic Research Articles
101388.0,Explaining the risk premiums of life settlements,2021,期刊論文,Pacific-Basin Finance Journal,O,,Ko-Lun Kung;Ming-Hua Hsieh;Jin-Lung Peng;Chenghsien Jason Tsai;Jennifer L. Wang,Basic_or_Discovery_Scholarship,E1:Academic Research Articles
128655.0,Network based discriminant analysis for multiclassification,2022,期刊論文,Journal of Classification,X,,Li-Pang Chen,Basic_or_Discovery_Scholarship,E1:Academic Research Articles
102064.0,新興間接取貨模式之創新市場定位研究,2021,會議論文,,X,,陳易群;許牧彥,Basic_or_Discovery_Scholarship,E4:Papers in Academic conferences
113615.0,"Historical High, Time-Varying Anchoring Biases, and Stock Return Predictability",2022,期刊論文,Journal of Financial Studies,O,,"Lo, Wen-Chi;Robin K. Chou;Kuan-Cheng Ko;Nien-Tzu Yang",Basic_or_Discovery_Scholarship,E1:Academic Research Articles
113618.0,XFlag: Explainable Fake News Detection Model on Social Media,2022,期刊論文,,X,,郁方,Basic_or_Discovery_Scholarship,E1:Academic Research Articles
119430.0,"Trade Secret Protection Against Misappropriation Committed by Your Foreign Distributor—A Lesson from AtriCure, Inc. v. Jian Meng",2022,期刊論文,Journal of the Patent and Trademark Office Society,X,,Ping-Hsun Chen,Basic_or_Discovery_Scholarship,E1:Academic Research Articles
123260.0,Understanding the Predictive Factors of Dementia for Older Adults: A Machine Learning Approach for Modeling the Dementia Influencers,2022,期刊論文,International Journal of Human-Computer Studies,O,,簡士鎰;Shiau-Fang Chao;Yihuang Kang;Chan Hsu;Meng-Hsuan Yu;Chan-Tung Ku,Basic_or_Discovery_Scholarship,E1:Academic Research Articles
125916.0,普祺樂實業有限公司—從業務思維到共贏策略,2022,期刊論文,管理評論,O,,田耕銘;王倩逸;張深閔;黃政仁,Basic_or_Discovery_Scholarship,E1:Academic Research Articles
301012.0,數大不一定美-旁觀者效應對群眾募資案成敗之影響,2022,期刊論文,台大管理論叢,O,,周文卿;傅浚映;于卓民;黃國峯,Basic_or_Discovery_Scholarship,E1:Academic Research Articles
103903.0,"CEO Succession, Audit Pricing, and Firm Value: The Role of Industry Knowledge",2021,期刊論文,Review of Accounting and Auditing Studies,O,,"Chao, C-L;洪叔民",Basic_or_Discovery_Scholarship,E1:Academic Research Articles
121807.0,Knowledge Management Strategies Based on Environment-Dependent and Organizational Learning Patterns,2022,期刊論文,Sun Yat-sen Management Review,O,,Chin-Fu Ho;Wei-Hsi Hung;I-Cheng Chang;Jau-Jeng Jou;Wen-Hsiung Wu,Basic_or_Discovery_Scholarship,E1:Academic Research Articles
101654.0,Trimmed estimator for circular-circular regression: breakdown properties and an exact algorithm for computation,2022,期刊論文,Statistics,O,,"Jha, J.;Biswas, A.;鄭宗記",Basic_or_Discovery_Scholarship,E1:Academic Research Articles
124407.0,Managerial ability and tax aggressiveness,2022,期刊論文,China Accounting and Finance Review,X,,Bill B. Francis;Xian Sun;Chia-Hsiang Weng;Qiang Wu,Basic_or_Discovery_Scholarship,E1:Academic Research Articles
308002.0,論保險業獨立董事之效能強化,2022,專書篇章,,X,,林建智;陳品璇,Basic_or_Discovery_Scholarship,E8:Chapters in books
354008.0,A Study of Forecasting Tennis Matches via the Glicko Model,2022,期刊論文,PLoS ONE,O,,余清祥;周珮婷;謝明輝;蕭立承,Basic_or_Discovery_Scholarship,E1:Academic Research Articles
121807.0,A Self-Assessment Framework for Global Supply Chain Operations: Case Study of a Machine Tool Manufacturer,2022,期刊論文,Journal of Global Information Management,O,,Fang-Kai Chang;Wei-Hsi Hung;Chieh-Pin Lin;I-Cheng Chang,Basic_or_Discovery_Scholarship,E1:Academic Research Articles
128655.0,Bayesian analysis of infectious diseases: COVID-19 and beyond,2022,期刊論文,"Journal of the Royal Statistical Society, Series A",X,,Li-Pang Chen,Basic_or_Discovery_Scholarship,E1:Academic Research Articles
118732.0,A study of forecasting tennis matches via the Glicko model,2022,期刊論文,PLOS ONE,X,,Jack C. Yue;Elizabeth P. Chou;Ming-Hui Hsieh;Li-Chen Hsiao,Basic_or_Discovery_Scholarship,E1:Academic Research Articles
119430.0,"A Pharmaceutical Formulation as a Claim Term Cannot “Target” a Plasma Concentration-Time Profile Under 35 U.S.C. § 112: A Lesson from Horizon Pharma, Inc. v. Dr. Reddy's Laboratories Inc.",2022,期刊論文,Biotechnology Law Report,X,,Ping-Hsun Chen,Basic_or_Discovery_Scholarship,E1:Academic Research Articles
128655.0,"Introduction to high-dimensional statistics Christophe, Giraud, Chapman and Hall/CRC, 2021, 364 pages",2022,期刊論文,Journal of the Royal Statistical Society: Series A,X,,Li-Pang Chen,Basic_or_Discovery_Scholarship,E1:Academic Research Articles
125920.0,Online community’s recognition and continued participation in idea competitions,2022,期刊論文,Decision Sciences,O,,Kai-Yu Hsieh;Ping Xiao;Noshir Contractor;Li Wang,Basic_or_Discovery_Scholarship,E1:Academic Research Articles
359001.0,A Framework of the Value Co-Creation Cycle in Platform Businesses: An Exploratory Case Study,2022,期刊論文,Sustainability,O,,Feng-Shang Wu;Chia-Chang Tsai,Basic_or_Discovery_Scholarship,E1:Academic Research Articles
113615.0,Algorithmic Trading and Market Quality: Evidence from the Taiwan Index Futures Market,2022,期刊論文,Journal of Futures Markets,O,,"Chang, Yakai;Robin K. Chou",Basic_or_Discovery_Scholarship,E1:Academic Research Articles
359001.0,美中科技戰發展情境分析與我國產業政策之挑戰,2020,專書,,X,,陳綠蔚;劉江彬;沈泰民;吳豐祥;盧文祥;王偉霖;陳桂恆;許曉芬,Basic_or_Discovery_Scholarship,E7:Books (e.g. research monographs)
101654.0,Evaluating the effectiveness of population-based breast cancer service screening: an analysis of parsimonious patient survival information with the time-varying Cox model,2022,期刊論文,International Journal of Epidemiology,O,,"Chang, R. W.-J.;Jen, G. H.-H.;Lin, K.-C.;鄭宗記;Chuang, S.-Y.;Pan, S.-L.;Chen, T. H.-H.;Yen, A. M.-F.",Basic_or_Discovery_Scholarship,E1:Academic Research Articles
308003.0,Index-based Renewable Energy Insurance for Taiwan Solar Photovoltaic Power Plants,2022,期刊論文,Risk Management and Insurance Review,O,,廖士傑;張士傑;鄭宗記,Basic_or_Discovery_Scholarship,E1:Academic Research Articles
125959.0,"To drink, or to exercise: That is (not) the question! Daily effects of alcohol consumption and exercise on well-being",2022,期刊論文,Applied Psychology: Health and Well-Being,O,,Seojin Stacey Lee;Kyunghwa Yu;Eunsoo Choi;Incheol Choi,Basic_or_Discovery_Scholarship,E1:Academic Research Articles
125916.0,Technology Relatedness on M&A Innovation Performance: Evidence from Taiwan’s Electronics Industry,2022,會議論文,,X,,Cheng Jen Huang;Guo-Wei Chen,Basic_or_Discovery_Scholarship,E4:Papers in Academic conferences
129361.0,When Service Providers Become Service Recipients: Negative Spillover Effect of Burnout among Frontline Luxury Service Providers,2021,期刊論文,Current Psychology,O,,Hyowon Hyun;Kyungwon Lee;June-ho Chung;Jungkun Park,Basic_or_Discovery_Scholarship,E1:Academic Research Articles
129361.0,Knowledge Workers’ Existential Affirmation and Innovativeness: A Kierkegaardian Redescription of Drucker,2021,期刊論文,European Journal of Innovation Management,O,,Minsuk Matthew Shin;June-ho Chung;Jiwon Lee,Basic_or_Discovery_Scholarship,E1:Academic Research Articles
116259.0,Divergence and Pair Trading Strategy,2021,期刊論文,Sun Yat-Sen Management Review,O,,Weifeng Hung;Ching-Ting Lin;Chin-Han Lee;Shih-Wei Lee,Basic_or_Discovery_Scholarship,E1:Academic Research Articles
116259.0,"Aggregate 52-week high, limited attention, and time-varying momentum profits",2022,期刊論文,Journal of Banking and Finance,O,,WeifengHung;Ching-Ting Lin;J. Jimmy Yang,Basic_or_Discovery_Scholarship,E1:Academic Research Articles
128655.0,Boosting method for length-biased and interval-censored survival data subject to high-dimensional error-prone covariates,2022,會議論文,,X,,Li-Pang Chen;Bangxu Qiu,Basic_or_Discovery_Scholarship,E4:Papers in Academic conferences
125511.0,Modeling Pandemic Mortality Risk and its Application to Mortality- Linked Security Pricing,2022,期刊論文,Insurance Mathematics and Economics,O,,Fen-Ying Chen;Sharon S. Yang;Hong-Chih Huang,Basic_or_Discovery_Scholarship,E1:Academic Research Articles
101654.0,Index-based renewable energy insurance for Taiwan Solar Photovoltaic Power Plants,2022,期刊論文,Risk Management and Insurance Review,X,,廖士傑;張士傑;鄭宗記,Basic_or_Discovery_Scholarship,E1:Academic Research Articles
119430.0,論涉及專利連結之專利侵權訴訟與其訴訟標的價額之計算,2022,期刊論文,交大法學評論,X,,陳秉訓,Basic_or_Discovery_Scholarship,E1:Academic Research Articles
125908.0,Humanizing Chatbots: The Effect of Fear from the COVID-19 Pandemic,2022,會議論文,,X,,Cong-Minh Dinh;Sungjun (Steven) Park,Basic_or_Discovery_Scholarship,E4:Papers in Academic conferences
128655.0,Nonparametric discriminant analysis with network structures in predictor,2022,期刊論文,Journal of Statistical Computation and Simulation,X,,Li-Pang Chen,Basic_or_Discovery_Scholarship,E1:Academic Research Articles
128655.0,De-noising analysis of noisy data with graphical models,2022,期刊論文,Electronic Journal of Statistics,X,,Li-Pang Chen;Grace Yi,Basic_or_Discovery_Scholarship,E1:Academic Research Articles
128655.0,Network-based discriminant analysis for multiclassification,2022,會議論文,,X,,Li-Pang Chen,Basic_or_Discovery_Scholarship,E4:Papers in Academic conferences
127274.0,Exploring the Opportunities of Bricolage for Martech Scale-Ups from Resource-Constrained Perspective,2022,會議論文,,X,,Chih-Yuan Chou;Yu Xi Tan,Basic_or_Discovery_Scholarship,E4:Papers in Academic conferences
127274.0,Social Media and Interactive Affection on Performance: A Perspective from Transparency,2022,會議論文,,X,,Chih-Yuan Chou;Jun Huang,Basic_or_Discovery_Scholarship,E4:Papers in Academic conferences
124407.0,Can Insider Board and Board Professionalism Improve Innovation Investment?,2022,會議論文,,X,,Yenn-Ru Chen;Ming-Hsien Ethan Hsueh;Chia-Hsiang Weng,Basic_or_Discovery_Scholarship,E4:Papers in Academic conferences
118586.0,An attention algorithm for solving large scale structured L0-norm penalty estimation problems,2021,期刊論文,Japanese Journal of Statistics and Data Science,X,,Tso-Jung Yen;Yu-Min Yen,Basic_or_Discovery_Scholarship,E1:Academic Research Articles
117066.0,An Empirical Study of Information Technology Capabilities to Enable Value Chain Activities and Interfaces,2023,期刊論文,Information Systems Frontiers,O,,周彥君;Benjamin B. M. Shao,Basic_or_Discovery_Scholarship,E1:Academic Research Articles
123260.0,The Influence of Personality Traits in Human-Humanoid Robot Interaction,2022,會議論文,,X,,簡士鎰;Chih-Ling Chen;Yao-Cheng Chan,Basic_or_Discovery_Scholarship,E4:Papers in Academic conferences
102703.0,The Information-Leveling Role of Management Forecast Consistency in Facilitating Investment Efficiency,2022,期刊論文,European Accounting Review(A first tier)),O,,"金成隆;Chiu, P. C.;Haight, T;Yu, P. H",Basic_or_Discovery_Scholarship,E1:Academic Research Articles
102108.0,Credit Default Swaps and Corporate Performance Smoothing,2022,期刊論文,Journal of Corporate Finance,O,,Wei-Shao Wu;Robert C.W. Fok;Yuanchen Chang;Chao-Jung Chen,Basic_or_Discovery_Scholarship,E1:Academic Research Articles
121784.0,Identifying future competitors with patent text mining,2022,會議論文,,X,,"林怡伶;Sung, Huang-Chih;Yang, Wei-An;Cheng, Chun-Yen",Basic_or_Discovery_Scholarship,E4:Papers in Academic conferences
123164.0,"The More, the Merrier? The Bystander Effect on Crowdfunding Platforms.",2022,期刊論文,NTU MANAGEMENT REVIEW,O,,傅浚映;周文卿;于卓民;黃國峯,Basic_or_Discovery_Scholarship,E1:Academic Research Articles
115898.0,Enhancing IT industry employees’ service innovation performance: antecedents and outcomes of service innovation engagement,2022,期刊論文,European Journal of Marketing,O,,白佩玉;H.-T. Tsai;J.-Y. Zhong,Basic_or_Discovery_Scholarship,E1:Academic Research Articles
128693.0,運用隨機共同成本邊界函數聯合估計中國銀行業之成本效率及市場競爭度,2020,期刊論文,經濟論文,O,,黃台心;陳禹伶;邱義晃,Basic_or_Discovery_Scholarship,E1:Academic Research Articles
128693.0,Imposing Regularity Conditions to Measure Banks’ Productivity Changes in Taiwan Using a Stochastic Approach,2020,期刊論文,Asia-Pacific Financial Markets,X,,T.H. Huang;Y.H. Chiu;C.Y. Mao,Basic_or_Discovery_Scholarship,E1:Academic Research Articles
128693.0,臺灣國際觀光旅館考慮要素內生性的兩部門技術效率分析,2020,期刊論文,經濟研究,O,,黃台心;邱義晃;黃廉淨,Basic_or_Discovery_Scholarship,E1:Academic Research Articles
128693.0,運用網絡隨機共同邊界模型與關聯結構法比較我國金控與非金控銀行經營效率,2020,期刊論文,人文及社會科學集刊,O,,黃台心;王允立;黃國睿,Basic_or_Discovery_Scholarship,E1:Academic Research Articles
128693.0,運用隨機共同邊界模型比較我國金控與非金控銀行之生產效率—考慮要素內生性問題,2021,期刊論文,經濟論文叢刊,O,,黃台心;黃國睿;鄭人瑋,Basic_or_Discovery_Scholarship,E1:Academic Research Articles
128694.0,Excess Volatility and Market Efficiency in Government Bond Markets: The ASEAN-5 Contex,2020,期刊論文,Journal of Asset Management,X,,Kin-Boon Tang,Basic_or_Discovery_Scholarship,E1:Academic Research Articles
128694.0,Cojump risks and their impacts on option pricing,2020,期刊論文,,X,,廖四郎,Basic_or_Discovery_Scholarship,E1:Academic Research Articles
354008.0,地理加權迴歸在視覺化分析之探討,2022,期刊論文,統計學報,X,,余清祥;梁穎誼;郭柔芸,Basic_or_Discovery_Scholarship,E1:Academic Research Articles
128655.0,Unbiased boosting estimation for censored survival data,2022,期刊論文,Statistica Sinica,X,,Li-Pang Chen;Grace Yi,Basic_or_Discovery_Scholarship,E1:Academic Research Articles
128655.0,Handbook of Meta-Analysis,2022,期刊論文,Biometrics,X,,Li-Pang Chen,Basic_or_Discovery_Scholarship,E1:Academic Research Articles
354008.0,Selection effect modification to the Lee-Carter model,2023,期刊論文,European Actuarial Journal,X,,余清祥;林昭廷;楊育綾;陳怡君;蔡宛臻,Basic_or_Discovery_Scholarship,E1:Academic Research Articles
121784.0,The effects of intimacy and proactivity on trust in human-humanoid robot interaction,2022,期刊論文,Information Systems Fron,X,,Shih-Yi Chien;林怡伶;Bu-Fang Chang,Basic_or_Discovery_Scholarship,E1:Academic Research Articles
122802.0,Learning Dynamic Malware Representation from Common Behavior,2022,期刊論文,Journal of Information Science and Engineering,X,,黃意婷;陳廷易;蕭舜文;孫雅麗,Basic_or_Discovery_Scholarship,E1:Academic Research Articles
122802.0,以區塊鏈技術、流程安全與選民隱私設計之去中心化投票架構,2022,期刊論文,資訊管理學報,O,,黃建勛;蕭舜文,Basic_or_Discovery_Scholarship,E1:Academic Research Articles
130035.0,鬍鬚張：本土小吃攤企業化經營之例規發展,2022,個案,,X,,梅國卿;吳思華,Applied_or_Integration_Application_Scholarship,E6:Published Case Studies
130035.0,蔦屋書店：穿越網路衝擊的實體新典範,2021,個案,,X,,梅國卿;吳思華,Applied_or_Integration_Application_Scholarship,E6:Published Case Studies
101654.0,Exploring factors related to agreement between importance and satisfaction of subjective well-being indicators: evidence from Taiwan,2023,期刊論文,Quality & Quantity,X,,"鄭宗記;Lin, C.-Y.;Wang, S.-C.",Basic_or_Discovery_Scholarship,E1:Academic Research Articles
125803.0,"Supply Chain Technology Spillover, Customer Concentration, and Product Invention",2022,期刊論文,Journal of Economics and Management Strategy,O,,Po-Hsuan Hsu;Hai-Ping Hui;Hsiao-Hui Lee;Kevin Tseng,Basic_or_Discovery_Scholarship,E1:Academic Research Articles
354005.0,Logarithmic confidence estimation of a ratio of binomial proportions for dependent populations,2023,期刊論文,Journal of Applied Statistics,O,,"Kokaew, A;Bodhisuwan, W.;Yang, S-F.;Volodin, A.",Basic_or_Discovery_Scholarship,E1:Academic Research Articles
354005.0,A New Multivariate Dispersion Control Chart,2022,會議論文,,X,,"Yang, SF;Liu, YL.",Basic_or_Discovery_Scholarship,E4:Papers in Academic conferences
123260.0,Coding Peekaboom: A Gaming Mechanism for Harvesting Programming Concepts,2022,期刊論文,Education and Information Technologies,O,,Yi-Ling Lin;簡士鎰;Wei-Cheng Su;Sharon Ihan Hsiao,Basic_or_Discovery_Scholarship,E1:Academic Research Articles
