teacher_id,item_name,item_year,item_type,journal,journal_type,co_worker_in,co_worker_out,scholarship_type,equis
114671.0,「保險商品條款解構分析」研究案,2020,,,X,彭金隆,,Applied_or_Integration_Application_Scholarship,E3:Studies and Reports commissioned by companies and gov't agencies(企業、政府、科技部產學合作計畫)
114671.0,2016.08.01 ~ 2017.04.30因應IFRS9與IFRS4下保險公司資產配置未來趨勢,2016,,,X,黃泓智、蔡政憲、王儷玲,詹芳書,Applied_or_Integration_Application_Scholarship,E3:Studies and Reports commissioned by companies and gov't agencies(企業、政府、科技部產學合作計畫)
114671.0,2016.08.01 ~ 2017.07.31 影響各國銀行保險需求市場發展的重要因素分析,2016,,,X,,,Applied_or_Integration_Application_Scholarship,E3:Studies and Reports commissioned by companies and gov't agencies(企業、政府、科技部產學合作計畫)
114671.0,2016.11.15 ~ 2017.10.14解決現行學生團體保險招標困難方案法制化之研究計畫,2016,,,X,陳俊元,李志峰,Applied_or_Integration_Application_Scholarship,E3:Studies and Reports commissioned by companies and gov't agencies(企業、政府、科技部產學合作計畫)
114671.0,"2017.07, '我國金融科技創新實驗落地機制之檢視與構建, ' 月旦法學雜誌, No.266, pp.5-21.",2017,期刊論文,The Taiwan Law Review (月旦法學雜誌),X,,臧正運,Applied_or_Integration_Application_Scholarship,E2:Practices-oriented Articles
114671.0,2020金融服務產業未來展望：數位科技創新,2020,,,X,王儷玲,,Applied_or_Integration_Application_Scholarship,E3:Studies and Reports commissioned by companies and gov't agencies(企業、政府、科技部產學合作計畫)
114671.0,以客戶為中心的旅平險投保場景評估案,2018,,,X,王儷玲,,Applied_or_Integration_Application_Scholarship,E3:Studies and Reports commissioned by companies and gov't agencies(企業、政府、科技部產學合作計畫)
114671.0,去中心化風險移轉經營模式之監理 與保險業因應策略分析,2019,,,X,彭金隆,,Applied_or_Integration_Application_Scholarship,E3:Studies and Reports commissioned by companies and gov't agencies(企業、政府、科技部產學合作計畫)
114671.0,我國UBI汽車保險外溢保單消費者行為之研究,2020,,,X,彭金隆,,Applied_or_Integration_Application_Scholarship,E3:Studies and Reports commissioned by companies and gov't agencies(企業、政府、科技部產學合作計畫)
114671.0,金融科技在職教育訓練課程,2020,,,X,王儷玲,,Applied_or_Integration_Application_Scholarship,E3:Studies and Reports commissioned by companies and gov't agencies(企業、政府、科技部產學合作計畫)
114671.0,附保證投資型保險商品的設計與評價,2020,,,X,謝明華,,Applied_or_Integration_Application_Scholarship,E3:Studies and Reports commissioned by companies and gov't agencies(企業、政府、科技部產學合作計畫)
114671.0,個人退休規劃與策略之研究計畫,2020,,,X,王儷玲,,Applied_or_Integration_Application_Scholarship,E3:Studies and Reports commissioned by companies and gov't agencies(企業、政府、科技部產學合作計畫)
114671.0,手機門號進行身分識別的Mobile ID(MID)行動身分識別服務及一次性密碼(OTP),2019,,,X,彭金隆,,Applied_or_Integration_Application_Scholarship,E3:Studies and Reports commissioned by companies and gov't agencies(企業、政府、科技部產學合作計畫)
114671.0,"2016.04, 'The Extension from Independence to Dependence between Jump Frequency and Jump Size in Markov-modulated Jump Diffusion Models, ' The North-American Journal of Economics and Finance, Vol.37 (2016), pp.217–235.(SSCI)",2016,期刊論文,The North-American Journal of Economics and Finance,O,林士貴,趙維雄 、吳安琪,Basic_or_Discovery_Scholarship,E1:Academic Research Articles
114671.0,"2017.07, 'Diversification versus Strategic Focus: Evidence from Insurance Intermediaries in Taiwan, ' The Geneva Papers on Risk and Insurance - Issues and Practice(科技部保險精算領域 B+級期刊), Vol.42, No.3, pp.530–555.",2017,期刊論文,The Geneva Papers on Risk and Insurance - Issues and Practice,O,,Li Ru Chen;Jennifer Wang;Larry Tzeng,Basic_or_Discovery_Scholarship,E1:Academic Research Articles
114671.0,"2016.12, 'Diversification versus Strategic Focus: Evidence from Insurance Intermediaries in Taiwan, ' The Geneva Papers on Risk and Insurance - Issues and Practice,.(SSCI)",2016,期刊論文,The Geneva Papers on Risk and Insurance - Issues and Practice,O,王儷玲,曾郁仁; 陳麗如,Basic_or_Discovery_Scholarship,E1:Academic Research Articles
114671.0,"2017.06, '我國推動反向抵押貸款及保險可行性之研究, ' 保險專刊, Vol.第 33 卷, No.第 2 期, pp.1-35.",2017,期刊論文,Insurance Monograph (保險專刊),X,,謝幸芳,Applied_or_Integration_Application_Scholarship,E2:Practices-oriented Articles
101388.0,新興科技創新營運模式-金融科技創新營運研究中心設立與維運計畫(4/4),2020,,,X,邱志聖,,Basic_or_Discovery_Scholarship,E15:Other(Please describe)其他(科技部學術型計畫 MOST Research Project)
114671.0,"2017.12, '我國健康管理保險商品監理措施之研究, ' 保險專刊, Vol.33, No.(4), pp.1-32.",2017,期刊論文,Insurance Monograph (保險專刊),X,,任沛雙,Applied_or_Integration_Application_Scholarship,E2:Practices-oriented Articles
114671.0,檢視保險法第177-1條有關敏感性個人資料規範之必要性,2020,期刊論文,Insurance Monograph (保險專刊),X,王正偉,吳珞齊,Applied_or_Integration_Application_Scholarship,E2:Practices-oriented Articles
114671.0,"2017.03, 'The Impact of Bancassurance on the Efficiency and Profitability of Banks: Evidence from Taiwan, ' Journal of Banking and Finance(科技部財務領域 Atier1 級期刊), Vol.80(2017), pp.1-13.",2017,期刊論文,Journal of Banking and Finance,O,,V. Cheng；J.Wang；Y.C.Chen,Basic_or_Discovery_Scholarship,E1:Academic Research Articles
114671.0,"2017.07, '影響台灣保險業不動產投資行為因素的分析, ' 住宅學報,",2017,期刊論文,Journal of Housing Studies (住宅學報),O,,王建安,Basic_or_Discovery_Scholarship,E1:Academic Research Articles
114671.0,網絡互助之運作及發展探討 -以中國大陸「相互保」與「相互寶」為例,2020,期刊論文,Journal of Life Insurance Management (壽險管理期刊),X,,,Applied_or_Integration_Application_Scholarship,E2:Practices-oriented Articles
114671.0,Statistical and Bibliometric Analyses of the Effects of Financial Innovation,2020,期刊論文,LIBRARY HI TECH,O,,Ting-Hsuan Chen,Basic_or_Discovery_Scholarship,E1:Academic Research Articles
114671.0,金融科技監理與我國金融監理沙盒制度之檢視,2019,期刊論文,Management Review (管理評論),O,,臧正運,Basic_or_Discovery_Scholarship,E1:Academic Research Articles
114671.0,保險科技是否威脅傳統保險業？－網路風險分散平台之比較分析,2018,期刊論文,Management Review (管理評論),O,,,Basic_or_Discovery_Scholarship,E1:Academic Research Articles
114671.0,學生團體保險之改革與法制芻議,2018,期刊論文,Ming Chuan University Law Review (銘傳大學法學論叢),O,,,Applied_or_Integration_Application_Scholarship,E2:Practices-oriented Articles
114671.0,"2017.05, '巨量資料應用在台灣個資法架構下的法律風險, ' 臺大管理論叢, Vol.27, No.2s, pp.1-26.",2017,期刊論文,NTU Management Review (臺大管理論叢),O,,陳俞沛;孫群,Basic_or_Discovery_Scholarship,E1:Academic Research Articles
114671.0,"2017.05, '壽險公司銀行保險通路策略會不會受到競爭者行為的影響?, ' 臺大管理論叢, Vol.27, No.2s, pp.1-28.",2017,期刊論文,NTU Management Review (臺大管理論叢),O,,魏筱昀，陳彥志,Basic_or_Discovery_Scholarship,E1:Academic Research Articles
114671.0,實施IFRS 9 與IFRS 17對我國壽險業監理與經營影響之分析,2020,期刊論文,NTU Management Review (臺大管理論叢),O,蔡政憲,詹芳書,Basic_or_Discovery_Scholarship,E1:Academic Research Articles
114671.0,消費者透過銀行通路購買保險真的有比較好嗎？,2017,,,X,,,Basic_or_Discovery_Scholarship,E3:Studies and Reports commissioned by companies and gov't agencies(企業、政府、科技部產學合作計畫)
114671.0,國際財務報導準則IFRS17號公報下壽險業的商品策略分析研究案,2019,,,X,黃泓智,,Applied_or_Integration_Application_Scholarship,E3:Studies and Reports commissioned by companies and gov't agencies(企業、政府、科技部產學合作計畫)
114664.0,大專校院教學實踐研究計畫：應用魚缸式討論法及角色扮演法，提高以學生為中心之「風險管理與保險」英語課程的學習效果,2020,,,X,,,Teaching_and_Learning_Scholarship,E11:Articles on Pedagogic Development and Innovation
114671.0,開放銀行第三方服務業者訓練課程,2020,,,X,王儷玲,,Applied_or_Integration_Application_Scholarship,E3:Studies and Reports commissioned by companies and gov't agencies(企業、政府、科技部產學合作計畫)
114664.0,Does Asymmetric Information Exist in the Reinsurance Markets of Taiwan? Applying Quantile Regression and Natural-Experiment Method,2020,期刊論文,Management Review,O,,Juei-Hsiang Chen,Basic_or_Discovery_Scholarship,E1:Academic Research Articles
114664.0,Interest Rate Derivatives and Risk Exposure: Evidence from the Life Insurance Industry,2020,期刊論文,North American Journal of Economics and Finance,O,,"Hui-Hsuan Liu,Ariana Chang",Basic_or_Discovery_Scholarship,E1:Academic Research Articles
114664.0,Is trading in the shortest-term index options profitable?,2019,期刊論文,Review of Derivatives Research,O,,"Pan, Ging-Ginq,Tu-Cheng Wu",Basic_or_Discovery_Scholarship,E1:Academic Research Articles
114664.0,對台灣企業社會責任獎項評比的省思,2020,期刊論文,Review of Securities and Futures Markets (證券市場發展季刊),O,劉世慶,"張詠晴, 陳厚儒",Basic_or_Discovery_Scholarship,E1:Academic Research Articles
114664.0,"2016.03, 'Does Engagement in Corporate Social Responsibility Provide Strategic Insurance-like Effects?, ' Strategic Management Journal (科技部組織與管理領域第一級學術期刊),.",2016,期刊論文,Strategic Management Journal,X,,,Basic_or_Discovery_Scholarship,E1:Academic Research Articles
114664.0,The Effects of Business Mix on Internal and External Reinsurance Usage,2019,期刊論文,The Geneva Papers on Risk and Insurance - Issues and Practice,O,,Ching-Yuan Hsiao,Basic_or_Discovery_Scholarship,E1:Academic Research Articles
114664.0,"Analysis of the Clientele Effect, Information Content and Returns of the Shortest-term Index Options in Taiwan",2018,期刊論文,Journal of Futures Markets,O,,"Pan, Ging-Ginq,Tu-Cheng Wu",Basic_or_Discovery_Scholarship,E1:Academic Research Articles
114664.0,2016.06.30 ~ 2017.06.30癌症保險計畫,2016,,,X,,,Applied_or_Integration_Application_Scholarship,E12:Studies and Reports produced as part of an int'l network
114664.0,2016.08.01 ~ 2017.12.31再保險市場的資訊不對稱(2/2),2016,,,X,,,Basic_or_Discovery_Scholarship,E15:Other(Please describe)其他(科技部學術型計畫 MOST Research Project)
114664.0,"2017.07, 'What Motivates Insurers to use Internal and External Reinsurance? Evidence from the United Kingdom Life Insurance Industry,' The 2017 Asia-Pacific Risk and Insurance Annual Conference, APRIA.",2017,,,X,,Ching-Yuan Hsiao,Basic_or_Discovery_Scholarship,E4:Papers in Academic conferences
114664.0,2017.08.01 ~ 2018.12.31企業社會責任的類保險與分類效果,2017,,,X,,張詠晴,Basic_or_Discovery_Scholarship,E15:Other(Please describe)其他(科技部學術型計畫 MOST Research Project)
114664.0,2019年版本國際保險監理官協會(IAIS)保險核心原則(ICP)委外翻譯案,2020,,,X,,,Applied_or_Integration_Application_Scholarship,E3:Studies and Reports commissioned by companies and gov't agencies(企業、政府、科技部產學合作計畫)
114664.0,A Contingent Model for the Insurance-like Effects of Corporate Social Responsibility,2019,,,X,,Ariana Chang,Basic_or_Discovery_Scholarship,E4:Papers in Academic conferences
114671.0,開放銀行在電信業之研究與應用,2019,,,X,王儷玲,,Applied_or_Integration_Application_Scholarship,E3:Studies and Reports commissioned by companies and gov't agencies(企業、政府、科技部產學合作計畫)
114664.0,2016.07.01 ~ 2017.06.30歐盟Solvency Ⅱ實施制度及成效評估之研究,2016,,,X,,,Applied_or_Integration_Application_Scholarship,E12:Studies and Reports produced as part of an int'l network
114664.0,Can risk-neutral skewness and kurtosis subsume the information content of historical jumps?,2020,期刊論文,Journal of Financial Markets,O,,"Ging-Ging Pan, Tu-Cheng Wu",Basic_or_Discovery_Scholarship,E1:Academic Research Articles
114664.0,"Reinsurance, Debt Capacity and Financial Flexibility",2020,期刊論文,The Geneva Papers on Risk and Insurance - Issues and Practice,O,,Xiaoyi Li,Basic_or_Discovery_Scholarship,E1:Academic Research Articles
114664.0,Can Country Trade Flows Benefit from Improved Corporate Social Responsibility Ratings?,2019,期刊論文,Economic Modelling,O,,"Shou-Lin Yang,Ariana Chang,Yen-Hsun Chen",Basic_or_Discovery_Scholarship,E1:Academic Research Articles
114664.0,How Does Reinsurance and Derivatives Usage Affect Financial Performance? Evidence from the UK Non-life Insurance Industry,2019,期刊論文,Economic Modelling,O,,,Basic_or_Discovery_Scholarship,E1:Academic Research Articles
114671.0,新興科技創新營運模式-金融科技創新營運研究中心設立與維運計畫(4/4),2020,,,X,邱志聖,,Applied_or_Integration_Application_Scholarship,E3:Studies and Reports commissioned by companies and gov't agencies(企業、政府、科技部產學合作計畫)
114671.0,新興科技創新營運模式-金融科技創新營運研究中心設立與維運計畫-子計畫五(1/4),2017,,,X,,王儷容,Applied_or_Integration_Application_Scholarship,E3:Studies and Reports commissioned by companies and gov't agencies(企業、政府、科技部產學合作計畫)
114671.0,新興科技創新營運模式-金融科技創新營運研究中心設立與維運計畫-總計畫及子計畫四(1/4),2017,,,X,"別蓮蒂,陳恭,邱志聖,李佳玲,諶家蘭,蘇威傑,唐揆,王儷玲,吳安妮",,Applied_or_Integration_Application_Scholarship,E3:Studies and Reports commissioned by companies and gov't agencies(企業、政府、科技部產學合作計畫)
114671.0,新興科技創新營運模式-金融科技創新營運研究中心設立與維運計畫-總計畫及子計畫四(3/4),2019,,,X,唐揆,,Applied_or_Integration_Application_Scholarship,E3:Studies and Reports commissioned by companies and gov't agencies(企業、政府、科技部產學合作計畫)
114664.0,利率衍生性商品、風險曝露水準與公司績效,2017,期刊論文,Academia Economic Papers (經濟論文),O,,"Hui-Hsuan Liu, Chi-Feng Wang",Basic_or_Discovery_Scholarship,E1:Academic Research Articles
114671.0,會計制度變革(IFRS9、IFERS17)對我國金融保險業債務投資工具之影響研究,2019,,,X,彭金隆,,Basic_or_Discovery_Scholarship,E3:Studies and Reports commissioned by companies and gov't agencies(企業、政府、科技部產學合作計畫)
114664.0,衍生性金融商品、再保險與風險：以英國壽險業為例,2019,期刊論文,Academia Economic Papers (經濟論文),O,,蕭景元,Basic_or_Discovery_Scholarship,E1:Academic Research Articles
114664.0,資本對銀行績效的影響,2019,期刊論文,Academia Economic Papers (經濟論文),O,,"Hui-Yen Lee,Ching-Ping Wang",Basic_or_Discovery_Scholarship,E1:Academic Research Articles
114664.0,"2016.08, 'An Examination of the Relationship between Vehicle Insurance Purchase and the Frequency of Accidents, ' Asia Pacific Management Review,.",2016,期刊論文,Asia Pacific Management Review,X,,,Basic_or_Discovery_Scholarship,E1:Academic Research Articles
114664.0,Does institutional ownership affect the relationship between accounting quality and cost of capital? A panel smooth transition regression approach,2019,期刊論文,Asia Pacific Management Review,O,,"Tsung-Yu Hsieh,Ariana Chang",Basic_or_Discovery_Scholarship,E1:Academic Research Articles
114664.0,Socially Responsible Investment Returns and News: Evidence from Asia,2019,期刊論文,Corporate Social Responsibilty and Enviornmental Management,O,,"Stéphane Meng-Feng Yen,Chi-Feng Wang",Basic_or_Discovery_Scholarship,E1:Academic Research Articles
113035.0,Annotated Leading Copyright Cases in Major Asian Jurisdictions,2019,,,X,,,Basic_or_Discovery_Scholarship,E7:Books (e.g. research monographs)
113035.0,As a Matter of Standard for Asia and Beyond?,2019,,,X,,,Basic_or_Discovery_Scholarship,E8:Chapters in books
113035.0,China and India as Contrast Pair in Innovation and IP,2016,,,X,,Uday S. Racherla/ Kenneth G. Huang,Basic_or_Discovery_Scholarship,E8:Chapters in books
113035.0,Annotated Leading Patent Cases in Major Asian Jurisdictions,2017,,,X,,,Basic_or_Discovery_Scholarship,E7:Books (e.g. research monographs)
113035.0,論标准必要专利公平合理無歧視许可的亚洲标准,2019,期刊論文,Intellectual Property (知識產權),X,,,Basic_or_Discovery_Scholarship,E1:Academic Research Articles
113035.0,Annotated Leading Trademark Cases in Major Asian Jurisdictions,2019,,,X,,,Basic_or_Discovery_Scholarship,E7:Books (e.g. research monographs)
113035.0,亚洲知识产权法–美麗新世界,2020,期刊論文,Tsinghua Intellectual Property Review (清华知识产权评论),X,,郑淑凤,Basic_or_Discovery_Scholarship,E1:Academic Research Articles
113035.0,知识产权与司法—来自台湾的一些观察与省思,2020,期刊論文,SJTU Law Review (交大法学),X,,,Basic_or_Discovery_Scholarship,E1:Academic Research Articles
113035.0,從沒有準備處理、不能處理、不願處理到如何標準必要專利FRAND許可問題,2020,期刊論文,The Taiwan Law Review (月旦法學雜誌),X,,,Basic_or_Discovery_Scholarship,E1:Academic Research Articles
113035.0,從Google關鍵字廣告判決探討商標維權使用與商標侵權使用的區別,2016,期刊論文,The Taiwan Law Review (月旦法學雜誌),X,,,Basic_or_Discovery_Scholarship,E1:Academic Research Articles
113035.0,如何利用網路平臺提供者解決著作權全球授權的問題,2017,期刊論文,The Taiwan Law Review (月旦法學雜誌),X,,,Basic_or_Discovery_Scholarship,E1:Academic Research Articles
113035.0,司法判決格式的改革芻議,2017,期刊論文,The Taiwan Law Review (月旦法學雜誌),X,,,Basic_or_Discovery_Scholarship,E1:Academic Research Articles
113035.0,Individual Licensing Models and the Role of Internet Platform Providers,2017,期刊論文,Remuneration of Copyright Owners--Regulatory Challenges of New Business Models,X,,,Basic_or_Discovery_Scholarship,E8:Chapters in books
113035.0,著作权侵权和商标假冒的法定赔偿金：亚洲经验对CPTPP及RCEP的启发,2020,期刊論文,Law Review of Chongqing University (重慶大學法律評論),X,,張浩然,Basic_or_Discovery_Scholarship,E1:Academic Research Articles
113035.0,How Could Taiwan Copyright Act Follow the Patent and Trademark Regime and Adopt International Copyright Exhaustion?,2016,,,X,,,Basic_or_Discovery_Scholarship,E8:Chapters in books
113035.0,Asian IP Laws—An Area of Increasing Importance,2020,期刊論文,Journal of European and International IP Law,X,,Shufeng Zheng,Basic_or_Discovery_Scholarship,E1:Academic Research Articles
113035.0,貿易戰、大數據與演算法,2020,期刊論文,The Taiwan Law Review (月旦法學雜誌),X,,,Basic_or_Discovery_Scholarship,E1:Academic Research Articles
113035.0,Independent Protection and Territoriality as Principles for Determining Applicable Law for Copyright Cases in Taiwan?,2019,,,X,,,Basic_or_Discovery_Scholarship,E8:Chapters in books
113035.0,Some Features of Trademark Laws and Cases in Major Asian Jurisdictions,2019,,,X,,,Basic_or_Discovery_Scholarship,E8:Chapters in books
113035.0,"Innovation, Economic Development and IPR in China and India",2019,,,X,,Uday S. Racherla,Basic_or_Discovery_Scholarship,E7:Books (e.g. research monographs)
113035.0,"Unprepared, Unable and Unwilling to Deal with FRAND Licensing of SEPs in Taiwan?",2019,,,X,,,Basic_or_Discovery_Scholarship,E8:Chapters in books
113035.0,Transfer of Second-hand Firmware Installed in a New Clock Did Not Infringe the Copyright of the Firmware in Taiwan,2019,,,X,,,Basic_or_Discovery_Scholarship,E8:Chapters in books
113035.0,The Proposal for Pre-established Damages for Copyright Infringement,2019,,,X,,,Basic_or_Discovery_Scholarship,E8:Chapters in books
113035.0,The Future of Asian Trade Deals and IP Law,2019,,,X,,Julien Chasse,Basic_or_Discovery_Scholarship,E7:Books (e.g. research monographs)
113035.0,Taiwan IP Court Decisions Tend to Treat Likelihood of Confusion and Likelihood of Dilution as Mutually Interchangeable,2019,,,X,,,Basic_or_Discovery_Scholarship,E8:Chapters in books
113035.0,最高人民法院知識產權法見解及其作成方式的評價與反思,2018,期刊論文,Intellectual Property (知識產權),X,,張浩然,Basic_or_Discovery_Scholarship,E1:Academic Research Articles
113035.0,Some Features of Asian Copyright Law and Cases,2019,,,X,,,Basic_or_Discovery_Scholarship,E8:Chapters in books
113035.0,"SEPs, SSOs and FRAND­Asian and Global Perspectives on Fostering Innovation in Interconnectivity",2019,,,X,,Reto Hilty,Basic_or_Discovery_Scholarship,E7:Books (e.g. research monographs)
113035.0,"Royalty Setting Disputes Between Collective Management Organizations, Taiwan Intellectual Property Office and Cable TV Operators",2019,,,X,,,Basic_or_Discovery_Scholarship,E8:Chapters in books
113035.0,Remuneration of Copyright Owners--Regulatory   Challenges of New Business Models,2017,,,X,,,Basic_or_Discovery_Scholarship,E7:Books (e.g. research monographs)
113035.0,Propositions for Regulated Self-regulation of SSOs,2019,,,X,,Haoran Zhang,Basic_or_Discovery_Scholarship,E8:Chapters in books
113035.0,Principles for Determining Applicable Law for Trademark Infringement in Taiwan Applies mutatis mutandis to Cases involving Hong Kong Companies,2019,,,X,,,Basic_or_Discovery_Scholarship,E8:Chapters in books
113035.0,On the Need of Codifying IP Laws into the Civil Code of PRC and How,2019,,,X,,,Basic_or_Discovery_Scholarship,E8:Chapters in books
113035.0,Obviously Unfair Practice Yet No Trademark Use by Google’s Keyword Advertisement in Taiwan,2019,,,X,,,Basic_or_Discovery_Scholarship,E8:Chapters in books
113035.0,Market Survey Seldom Accepted by Taiwanese Courts in Trademark Litigation,2019,,,X,,,Basic_or_Discovery_Scholarship,E8:Chapters in books
113035.0,IPRs in China—Market-Oriented Innovation or Policy-Induced Rent-Seeking?,2016,,,X,,Chuntian Liu/Ji Huang,Basic_or_Discovery_Scholarship,E8:Chapters in books
113035.0,IP and FTAs—Friend or Foe?,2016,,,X,,,Basic_or_Discovery_Scholarship,E7:Books (e.g. research monographs)
113035.0,"Innovation and IPR in China and India—Myth, Realities and Opportunities",2016,,,X,,Uday S. Racherla,Basic_or_Discovery_Scholarship,E7:Books (e.g. research monographs)
113035.0,「探討給付著作權人的合理方式」國際研討會後記--兼論國際合作的一種模式,2016,期刊論文,Humanities and social sciences newsletter quarterly (人文與社會科學簡訊),X,,,Basic_or_Discovery_Scholarship,E1:Academic Research Articles
102064.0,製造廠商發展服務化對其組織創新之影響,2016,,,X,,林勇邑、黃邦寧,Basic_or_Discovery_Scholarship,E4:Papers in Academic conferences
113035.0,Taiwanese Courts Applying Dutch Law,2017,期刊論文,Annotated Leading Patent Cases in Major Asian Jurisdictions (City University of Hong Kong Press),X,,,Basic_or_Discovery_Scholarship,E8:Chapters in books
107009.0,翻轉式服務創新：探索制約下資源價值的轉換過程1/3,2018,,,X,,,Basic_or_Discovery_Scholarship,E15:Other(Please describe)其他(科技部學術型計畫 MOST Research Project)
107009.0,翻轉式服務創新：制約中的開放服務創新與文化科技應用(2/2),2018,,,X,,,Basic_or_Discovery_Scholarship,E15:Other(Please describe)其他(科技部學術型計畫 MOST Research Project)
107009.0,聯電案例：擴產的策略抉擇,2020,,,X,,,Basic_or_Discovery_Scholarship,E15:Other(Please describe)其他(科技部學術型計畫 MOST Research Project)
107009.0,個案發展取徑企業問題解決專案,2020,,,X,,,Basic_or_Discovery_Scholarship,E15:Other(Please describe)其他(科技部學術型計畫 MOST Research Project)
107009.0,負資源轉換：瀨戶內海島嶼之隨創過程,2019,,,X,,陳煥宏,Basic_or_Discovery_Scholarship,E14:Doctoral theses completed-supervised by core faculty
107009.0,科技導意：形塑使用者意會賦能博物館商店服務創新,2019,,,X,,徐嘉黛,Basic_or_Discovery_Scholarship,E14:Doctoral theses completed-supervised by core faculty
107009.0,思考的脈絡：創新，可能不擴散(增訂第三版),2016,,,X,,,Basic_or_Discovery_Scholarship,E7:Books (e.g. research monographs)
107009.0,翻轉式服務創新：探索制約下資源價值的轉換過程2/3,2019,,,X,,,Basic_or_Discovery_Scholarship,E15:Other(Please describe)其他(科技部學術型計畫 MOST Research Project)
107009.0,服務隨創：少力設計的邏輯思維 （增訂第二版）,2020,,,X,,,Basic_or_Discovery_Scholarship,E7:Books (e.g. research monographs)
107009.0,劣勢創新：企業與城市於制約中的資源隨創3/3,2016,,,X,,,Basic_or_Discovery_Scholarship,E15:Other(Please describe)其他(科技部學術型計畫 MOST Research Project)
107009.0,不用數字的研究：質性研究的思辯脈絡 （增訂第五版）,2020,,,X,,,Basic_or_Discovery_Scholarship,E7:Books (e.g. research monographs)
