teacher_id,item_name,item_year,item_type,journal,journal_type,co_worker_in,co_worker_out,scholarship_type,equis
101477.0,The relationship between Social Progress Index and GDP: The mediating role of national intellectual capital,2019,,,X,,"Tyan, J.",Basic_or_Discovery_Scholarship,E4:Papers in Academic conferences
101477.0,The role of motivational systems in dissecting the neural correlates of ambidextrous decision making,2018,,,X,,"Yen, N.S.、Li, C. W.、Chang, T. T.、Tan, D.、Chen, Y. C.",Basic_or_Discovery_Scholarship,E4:Papers in Academic conferences
101477.0,Understanding the Effect of Management Innovation on Hospital Performance: The Role of Organizational Capital,2016,,,X,,,Basic_or_Discovery_Scholarship,E4:Papers in Academic conferences
101477.0,人文社會與科技前瞻人才培育計畫-教師社群及課程模組培力計畫,2018,,,X,,,Basic_or_Discovery_Scholarship,E15:Other(Please describe)其他(科技部學術型計畫 MOST Research Project)
101477.0,人文社會與科技前瞻人才培育計畫-教師社群及課程模組培力計畫,2019,,,X,,,Basic_or_Discovery_Scholarship,E15:Other(Please describe)其他(科技部學術型計畫 MOST Research Project)
101477.0,市場導向型組織文化對企業競爭績效的影響：投資者關係的中介效果,2019,,,X,,劉丹,Basic_or_Discovery_Scholarship,E4:Papers in Academic conferences
101477.0,"呂葆光、林月雲(2016)農業轉型結合社會企業與公平貿易之商業模式探討以卡維蘭為例, 2016創新研究國際學術研討會, 政治大學, Nov. 12-13, 2016",2016,,,X,,,Basic_or_Discovery_Scholarship,E4:Papers in Academic conferences
101477.0,建立城市特色：智慧資本之觀點,2019,,,X,,,Basic_or_Discovery_Scholarship,E15:Other(Please describe)其他(科技部學術型計畫 MOST Research Project)
101477.0,"孫書恩、林月雲(2016) 台灣B型企業之企業社會責任的最佳實務研究, , 2016創新研究國際學術研討會, 政治大學, Nov. 12-13, 2016",2016,,,X,,,Basic_or_Discovery_Scholarship,E4:Papers in Academic conferences
101477.0,教育創新群力匯聚,2018,,,X,,,Basic_or_Discovery_Scholarship,E15:Other(Please describe)其他(科技部學術型計畫 MOST Research Project)
101477.0,教育創新群力匯聚,2019,,,X,,,Basic_or_Discovery_Scholarship,E15:Other(Please describe)其他(科技部學術型計畫 MOST Research Project)
101477.0,"游銘仁、許牧彥、林月雲、莊皓鈞(2016)廠商專佔能力策略和開放性的關係：探討創新類型的調節效果, 第四屆海峽兩岸科技管理學術年會, Oct. 2016西安中國",2016,,,X,,,Basic_or_Discovery_Scholarship,E4:Papers in Academic conferences
101477.0,無形資產：國家智慧資本、更佳生活指標、社會進步指標與永續社會指標相關性研究,2016,,,X,,,Basic_or_Discovery_Scholarship,E15:Other(Please describe)其他(科技部學術型計畫 MOST Research Project)
125563.0,Bring me to new life - marketing department reorganization at family business.,2018,,,X,,,Teaching_and_Learning_Scholarship,E4:Papers in Academic conferences
125563.0,"The Relationship Between Customer-Oriented Service Behavior, Internal Market Orientation, and Service Climate",2018,,,X,洪順慶,,Basic_or_Discovery_Scholarship,E4:Papers in Academic conferences
101477.0,"Lin, C.Y.Y.*, 2016.01, 'World cities that need transformation: Intellectual capital of 36 cities, ' Open Innovation Yearbook 2016, Publications Office of the European Union, pp.93-102.(*為通訊作者), 411128, 2016/01",2016,,,X,,,Applied_or_Integration_Application_Scholarship,E8:Chapters in books
101477.0,"Intangible capital of Nordic Countries: A navigation map, the 14th World Conference on Intellectual Capital for Communities",2018,,,X,,Leif Edvinsson,Basic_or_Discovery_Scholarship,E4:Papers in Academic conferences
101477.0,"Intangible assets: National intellectual capital comparison of Southeast Asian and Northeast Asian countries, AIB 2017 Annual Conference, July 1-5, 2017 Dubai",2017,,,X,,,Basic_or_Discovery_Scholarship,E4:Papers in Academic conferences
101477.0,Innovation and Entrepreneurship in an Educational Ecosystem: Cases from Taiwan,2019,,,X,,"Wu, S.H.",Basic_or_Discovery_Scholarship,E7:Books (e.g. research monographs)
117137.0,航空貨運業選擇棧板材質之關鍵因素─使用AHP方法,2019,期刊論文,Management Research (管理研究學報),X,,張國洋,Basic_or_Discovery_Scholarship,E1:Academic Research Articles
117137.0,影響消費者購買穿戴式裝置關鍵因素之研究─使用AHP方法,2017,期刊論文,Management Research (管理研究學報),X,,李岱航,Basic_or_Discovery_Scholarship,E1:Academic Research Articles
117137.0,Key Factors Affecting Passengers’ Selection of Low Cost Airline,2019,期刊論文,Soochow Journal of Economics and Business (東吳經濟商學學報),X,,"Sriworrarat, Mananya",Basic_or_Discovery_Scholarship,E1:Academic Research Articles
117137.0,兩岸消費者選擇訂房網站關鍵因素研究,2018,期刊論文,Soochow Journal of Economics and Business (東吳經濟商學學報),X,,玄燁、萬文隆,Basic_or_Discovery_Scholarship,E1:Academic Research Articles
101477.0,From IMPCT Coffee to Early Childhood Education in Poor Countries,2020,期刊論文,Fu Jen Management Review (輔仁管理評論),O,,"Giron, A. and Prudot, J. D.",Basic_or_Discovery_Scholarship,E1:Academic Research Articles
101477.0,智慧資本研究成果之實務應用,2020,期刊論文,Industry and Management Forum (產業與管理論壇),O,,,Basic_or_Discovery_Scholarship,E1:Academic Research Articles
101477.0,Intellectual capital of South Africa: A comparison with Poland and Romania,2018,期刊論文,Journal of Intellectual Capital,O,,,Basic_or_Discovery_Scholarship,E1:Academic Research Articles
101477.0,Reflections on JIC’s Twenty-year History and Suggestions for Future IC Research,2020,期刊論文,Journal of Intellectual Capital,O,,"Edvinsson, L.",Basic_or_Discovery_Scholarship,E1:Academic Research Articles
101477.0,"The creation of national intellectual capital from the perspective of Hofstede’s national culture, Journal of Intellectual Capital, 18(4) 807-831. Doi: doi.org/10.1108/JIC-11-2016-0117",2017,期刊論文,Journal of Intellectual Capital,O,,,Basic_or_Discovery_Scholarship,E1:Academic Research Articles
101477.0,《人文與社會科學簡訊》之編輯與發行,2016,,,X,,,Basic_or_Discovery_Scholarship,E15:Other(Please describe)其他(科技部學術型計畫 MOST Research Project)
125563.0,"The Relationship of Market-Oriented Culture, Internal-Market Orientation, Service Climate and Customer-Oriented Service Behavior: Cross-cultural Study of F&B Industry in Taiwan, China and the United States",2018,,,X,洪順慶,,Basic_or_Discovery_Scholarship,E4:Papers in Academic conferences
101477.0,"1.          Chair – Session 2.3.7, Human resource management, Global strategy, and firm performance, AIB 2017 Annual Conference, July 4, 2017 Dubai",2017,,,X,,,Basic_or_Discovery_Scholarship,E4:Papers in Academic conferences
101477.0,Blue Sea of Banking Industry in Taiwan: Case of O-Bank,2018,,,X,,,Basic_or_Discovery_Scholarship,E4:Papers in Academic conferences
101477.0,"Chen, M.Y.C., Yang, C. and Lin, C.Y.Y. (2016) Understanding the Effect of Management Innovation on Hospital Performance: The Role of Organizational Capital, NTU Management Review, 2016 Management Theory and Practice Conference, April 3-4, 2016 Kyoto, Japan",2016,,,X,,,Basic_or_Discovery_Scholarship,E4:Papers in Academic conferences
101477.0,Creative public service: Ruro Platform,2019,,,X,,"Liu, J.S.",Basic_or_Discovery_Scholarship,E4:Papers in Academic conferences
101477.0,Digital Competences: Comparing Advanced Countries with Developing Countries,2019,,,X,,,Basic_or_Discovery_Scholarship,E4:Papers in Academic conferences
101477.0,Dissecting the neural correlates of ambidextrous decision making,2018,,,X,,張葶葶、顏乃欣、譚丹琪,Basic_or_Discovery_Scholarship,E4:Papers in Academic conferences
101477.0,Educational entrepreneurs engaging in social innovation,2019,,,X,,"Wu, S.H.",Basic_or_Discovery_Scholarship,E4:Papers in Academic conferences
101477.0,Educational entrepreneurs: The making of educational innovation ecosystem,2019,,,X,,"Wu, S.H.",Basic_or_Discovery_Scholarship,E4:Papers in Academic conferences
101477.0,Educational Innovation Ecosystem,2019,,,X,,,Basic_or_Discovery_Scholarship,E4:Papers in Academic conferences
101477.0,Four way voice,2016,,,X,,,Basic_or_Discovery_Scholarship,E4:Papers in Academic conferences
101477.0,From IMPCT Coffee to Early Childhood Education in Poor Countries,2019,,,X,,"Giron, A.、Prudot, J.D.",Basic_or_Discovery_Scholarship,E4:Papers in Academic conferences
101477.0,A new breed of social entrepreneur: Educational entrepreneur,2018,,,X,,吳思華,Basic_or_Discovery_Scholarship,E4:Papers in Academic conferences
125563.0,台灣紡織業上市公司策略剖析,2016,,,X,張逸民,,Basic_or_Discovery_Scholarship,E8:Chapters in books
118370.0,How Can Corporations Adopt Confucianism in Business Practices? Two Representative Cases,2020,期刊論文,Business Ethics: A European Review,O,,,Basic_or_Discovery_Scholarship,E1:Academic Research Articles
118370.0,對台灣企業社會責任獎項評比的省思,2020,期刊論文,Review of Securities and Futures Markets (證券市場發展季刊),O,許永明,張詠晴，陳厚儒,Basic_or_Discovery_Scholarship,E1:Academic Research Articles
107991.0,"Lo, S. M.*;Shen, H. P.;Chen, J. C., 2016.02, 'An integrated approach to project management using Kano model and QFD: An empirical case study, ' Total Quality Management & Business Excellence, Vol.2016, pp.1-25.(SSCI)(*為通訊作者), 409570",2016,期刊論文,Total Quality Management & Business Excellence,O,,,Basic_or_Discovery_Scholarship,E1:Academic Research Articles
107991.0,An empirical investigation of the development process and capabilities of servitization: From OEM/ODM to OBM,2018,,,X,,"Sun, Y.J.",Basic_or_Discovery_Scholarship,E4:Papers in Academic conferences
107991.0,An exploration of servitization from the capability perspective: Cases of the fastener industry in Taiwan,2018,,,X,,"Wang, MinTai",Basic_or_Discovery_Scholarship,E4:Papers in Academic conferences
107991.0,以 TOE 架構探討企業導入工業 4.0 之意圖與挑戰: 競爭優勢之調節角色;(1/2),2019,,,X,,,Basic_or_Discovery_Scholarship,E15:Other(Please describe)其他(科技部學術型計畫 MOST Research Project)
107991.0,共享。共好 – 微笑單車 (YouBike),2019,,,X,,,Teaching_and_Learning_Scholarship,E6:Published Case Studies
107991.0,好食品的供應者–義美食品,2016,,,X,,,Teaching_and_Learning_Scholarship,E6:Published Case Studies
107991.0,好食品的提供者 – 義美食品 (I-Mei Food) 案例，政大商管個案中心 (CBCC) 發行,2017,,,X,,,Teaching_and_Learning_Scholarship,E6:Published Case Studies
107991.0,有溫度的服務 – 玉山銀行 (E-Sun Bank) 案例，政大商管個案中心 (CBCC) 發行。,2017,,,X,,,Teaching_and_Learning_Scholarship,E6:Published Case Studies
107991.0,有溫度的服務 –玉山銀行 (E.Sun Bank) 案例,2016,,,X,,,Teaching_and_Learning_Scholarship,E6:Published Case Studies
107991.0,從供應商發展到永續供應鏈整合：供應鏈領導力調節角色之探討,2016,,,X,,,Basic_or_Discovery_Scholarship,E15:Other(Please describe)其他(科技部學術型計畫 MOST Research Project)
107991.0,"Lo, S. M.*;Shiah, Y.-A., 2016.04, 'Associating the motivation with the practices of firms going green: The moderator role of environmental uncertainty, ' Supply Chain Management: An International Journal, Vol.21, No.4, pp.485-498.(SSCI)(*為通訊作者), 410199",2016,期刊論文,Supply Chain Management: An International Journal,O,,,Basic_or_Discovery_Scholarship,E1:Academic Research Articles
107991.0,零售巨人的轉身 – 家樂福（Carrefour）,2019,,,X,,,Teaching_and_Learning_Scholarship,E6:Published Case Studies
305018.0,"蔡佩純*;林智偉;樓永堅, 2016.10, '來源國形象對消費者態度與行為影響之後設分析研究, ' 行銷科學學報, Vol.12, No.2, pp.141-164.(*為通訊作者), 409241",2016,期刊論文,Taiwan Journal of Marketing Science (行銷科學學報),X,,,Basic_or_Discovery_Scholarship,E1:Academic Research Articles
305018.0,"Chang, Joseph W., Hongxia Zhang and Yung-Chien Lou (2016), ""Brand similarity, cohesiveness and diversity in extension feedback effects,"" Paper presented in 2016 AMA Winter Marketing Educator's Conference, Las Vegas, NV, February 26-28.",2016,,,X,,"Chang, Joseph W., Hongxia Zhang",Basic_or_Discovery_Scholarship,E4:Papers in Academic conferences
305018.0,Does it Matter Whose Fault it is? The Moderating Effects of Similarity and Product Substitution on Consumer Boycotts of Parent and Subsidiary Corporations,2020,,,X,,曾威智,Basic_or_Discovery_Scholarship,E15:Other(Please describe)其他(科技部學術型計畫 MOST Research Project)
305018.0,"Parents’ Debts, Children’s Obligation? The Effect of Similarity on Consumers’ Boycott of Parent and Subsidiary Corporation",2019,,,X,,曾威智,Basic_or_Discovery_Scholarship,E4:Papers in Academic conferences
305018.0,The effect of power structure in the NPD teams on NPD performance: The external control perspective,2018,,,X,,"張家揚, 別蓮蒂",Basic_or_Discovery_Scholarship,E4:Papers in Academic conferences
305018.0,"To Gamble Or Not To Gamble: Effect Of Price Discount on Consumer Behavior, ' 2017 International Academic Conference New York, Clute Institute.(*為通訊作者)",2017,,,X,,,Basic_or_Discovery_Scholarship,E4:Papers in Academic conferences
305018.0,TO GAMBLE OR NOT TO GAMBLE: HOW THE DISCLOSURE OF THE WINNING ODDS MODERATES THE GAMBLED PRICE DISCOUNT ON CONSUMERS’ INTERNAL REFERENCE PRICE,2019,,,X,,蔡佩純,Basic_or_Discovery_Scholarship,E4:Papers in Academic conferences
305018.0,Variability of Brands: Perspectives of Perceived Entitativity,2019,,,X,,"Joseph W. Chang, Kai-Yu Wang",Basic_or_Discovery_Scholarship,E4:Papers in Academic conferences
305020.0,Free the Brand: How a Logo Frame Influences the Potentiality of Brand Extensions,2019,期刊論文,Journal of Brand Management,O,,"Chen, Yu-Shan Athena",Basic_or_Discovery_Scholarship,E1:Academic Research Articles
305018.0,父債子還？相似性、替代性及廠商回應策略對消費者抵制母子公司之研究(2/3),2019,,,X,,,Basic_or_Discovery_Scholarship,E15:Other(Please describe)其他(科技部學術型計畫 MOST Research Project)
305018.0,"以自發性導引法再探虛擬世界中的沉浸體驗, ' 管理學報, Vol.34, No.4, pp.497-528.(TSSCI)(*為通訊作者), 417555",2017,期刊論文,Journal of Management and Business Research (管理學報),O,"黃增隆*;別蓮蒂;樓永堅,",,Basic_or_Discovery_Scholarship,E1:Academic Research Articles
125884.0,Examining the effects of motivational usage for Instagram on brand engagement: The mediating role of advertising value,2019,期刊論文,Marketing Review,X,,Chia-Tung Chao,Basic_or_Discovery_Scholarship,E1:Academic Research Articles
107991.0,由多通路零售邁向全通路零售: 根據通路整合觀點之文獻回顧與議題探討,2020,期刊論文,NTU Management Review (臺大管理論叢),O,,夏佑安,Basic_or_Discovery_Scholarship,E1:Academic Research Articles
107991.0,"Lo, S. M.*, 2016.07, 'How supplier management practices affect exchange cost when going green: An empirical study, ' Management Review, Vol.35, No.3, pp.1-31.(TSSCI)(*為通訊作者), 408288",2016,期刊論文,Management Review,O,,,Basic_or_Discovery_Scholarship,E1:Academic Research Articles
118370.0,“Instant Return after Purchase” Incident,2020,,,X,"Lien-Ti Bei, Jia-Chun Chen",,Teaching_and_Learning_Scholarship,E6:Published Case Studies
118370.0,《任經理的抉擇》─該用Facebook資訊來徵才嗎?,2019,,,X,高雄大學 林杏子 中山大學  王豫萱,,Teaching_and_Learning_Scholarship,E6:Published Case Studies
118370.0,「秒買秒退」事件,2017,,,X,別蓮蒂 陳嘉純,,Teaching_and_Learning_Scholarship,E6:Published Case Studies
118370.0,2.2016台灣永續報告現況與趨勢 (2016),2016,,,X,,,Applied_or_Integration_Application_Scholarship,E7:Books (e.g. research monographs)
118370.0,"3.""對於台灣企業倫理與器義社會責任教育的反思""發表於企業倫理、社會責任與永續發展會 (2016)",2016,,,X,,,Basic_or_Discovery_Scholarship,E4:Papers in Academic conferences
118370.0,"4.""The innovations from Confucianism""發表於上海ISBEE World Congress.",2016,,,X,,,Basic_or_Discovery_Scholarship,E4:Papers in Academic conferences
118370.0,4.《對於英國轉型城鎮的探究》(台北，台達文教基金會) (2016),2016,,,X,,,Applied_or_Integration_Application_Scholarship,E3:Studies and Reports commissioned by companies and gov't agencies(企業、政府、科技部產學合作計畫)
118370.0,Applebee的社群媒體危機,2018,,,X,張欣綠,,Teaching_and_Learning_Scholarship,E6:Published Case Studies
118370.0,Chunghwa Post’s Sales Promotion Campaign for “Chunghwa Post VISA Debit Card”,2020,,,X,"Lien-Ti Bei, Jia-Chun Chen",,Teaching_and_Learning_Scholarship,E6:Published Case Studies
118370.0,Internal Hacking for Mooncakes in Alibaba Group Holding Co. Ltd.,2020,,,X,"Lien-Ti Bei, Jia-Chun Chen",,Teaching_and_Learning_Scholarship,E6:Published Case Studies
107991.0,Utilizing business process management (BPM) for performance improvement: A case study of an express company in Taiwan,2019,期刊論文,NTU Management Review (臺大管理論叢),O,,"Chang, Y.M.",Basic_or_Discovery_Scholarship,E1:Academic Research Articles
118370.0,Manager Ren’s Dilemma: Should he recruit according to information from Facebook?,2020,,,X,"Lin, Hsing-Tzu Wang, Yu-Hsuan Hsieh Ying-Che",,Teaching_and_Learning_Scholarship,E6:Published Case Studies
118370.0,大統油品危機事件,2017,,,X,元智大學 陳勁甫,,Teaching_and_Learning_Scholarship,E6:Published Case Studies
118370.0,中華電信499促銷方案,2019,,,X,別蓮蒂,,Teaching_and_Learning_Scholarship,E6:Published Case Studies
118370.0,阿里巴巴工程師搶月餅事件,2017,,,X,別蓮蒂 陳嘉純,,Teaching_and_Learning_Scholarship,E6:Published Case Studies
118370.0,信義房屋的「社區一家」計畫,2019,,,X,別蓮蒂,,Teaching_and_Learning_Scholarship,E6:Published Case Studies
118370.0,哲學家來創業―哲學新媒體有限公司,2018,,,X,張瑜倩,,Teaching_and_Learning_Scholarship,E6:Published Case Studies
118370.0,解散是負責任的經營決策？--復興航空的決定,2019,,,X,雲林科大 俞慧芸,,Teaching_and_Learning_Scholarship,E6:Published Case Studies
107991.0,海榮國際公司－供應鏈危機,2019,期刊論文,Industry and Management Forum (產業與管理論壇),O,,徐景輝*;于卓民,Basic_or_Discovery_Scholarship,E1:Academic Research Articles
107991.0,Response to Demand Uncertainty of Supply Chains: A Value-Focused Approach with AHP and TOPSIS,2018,期刊論文,"International Journal of Industrial Engineering: Theory, Applications and Practice",O,,"Chen, J., Liu, T.S.",Basic_or_Discovery_Scholarship,E1:Academic Research Articles
107991.0,Utilizing online stochastic optimization on scheduling of Intensity-Modulate Radiotherapy Therapy (IMRT),2020,期刊論文,Journal of Biomedical Informatics,O,,"Chang, W.H.;Chen, T.L.;Chen, J.C.;Wu, H.N.",Basic_or_Discovery_Scholarship,E1:Academic Research Articles
107991.0,The impact of relationship quality and supplier development on green supply chain integration: A mediation and moderation analysis,2018,期刊論文,Journal of Cleaner Production,O,,"Zhang, S. , Wang, Z., Zhao, X.",Basic_or_Discovery_Scholarship,E1:Academic Research Articles
118370.0,We Are One Project by Sinyi Real Estate Inc.,2020,,,X,Lien-Ti Bei,,Teaching_and_Learning_Scholarship,E6:Published Case Studies
125884.0,"Understanding the nature, uses and gratifications of social television: Implications for developing viewer engagement and network loyalty",2018,期刊論文,Journal of Broadcasting & Electronic Media,O,,"Jhih-Syuan Lin, Yongjun Sung",Basic_or_Discovery_Scholarship,E1:Academic Research Articles
305018.0,"大成與頂新之個案分析, ' 食尚品衛:台灣食品產業的發展, 巨流圖書股份有限公司, pp.161-195.(*為通訊作者), 419410, 2017/12",2017,,,X,,,Basic_or_Discovery_Scholarship,E7:Books (e.g. research monographs)
125884.0,"Unlocking the power of ephemeral content: The roles of motivations, gratification, need for closure, and engagement",2019,期刊論文,Computers in Human Behavior,O,,Hoi Ling Cheung,Basic_or_Discovery_Scholarship,E1:Academic Research Articles
305021.0,The attitudinal and behavioral impact of brand-centered human resource management: Employee and customer effects,2018,期刊論文,International Journal of Contemporary Hospitality Management,O,,"Chiang, Hsu-Hsin,David McConville",Basic_or_Discovery_Scholarship,E1:Academic Research Articles
123991.0,企業夥伴地理相鄰程度與合作契約治理設計之關聯研究(2/2),2019,,,X,,,Basic_or_Discovery_Scholarship,E15:Other(Please describe)其他(科技部學術型計畫 MOST Research Project)
123991.0,企業策略合作經驗與後續併購交易條款制定之關聯探討(1/2),2020,,,X,,,Basic_or_Discovery_Scholarship,E15:Other(Please describe)其他(科技部學術型計畫 MOST Research Project)
123991.0,The Role of Executive's Experience in Contract Design,2018,,,X,,"Fabrice Lumineau,Janet Bercovitz",Basic_or_Discovery_Scholarship,E4:Papers in Academic conferences
123991.0,The Effect of Perceived Incongruence on Contract Design: Evidence from Debt Contract,2019,,,X,,"Cyril Um,Wei Shi, Fabrice Lumineau",Basic_or_Discovery_Scholarship,E4:Papers in Academic conferences
123991.0,"Revisiting the Foundations of Organizational Distrust., ' Foundations and Trends in Management, now publishers., 418487, 2017/02",2017,,,X,,"Fabrice Lumineau, Roy J. Lewicki",Basic_or_Discovery_Scholarship,E7:Books (e.g. research monographs)
123991.0,"An Asymmetric View of Franchise Contracts, ' Academy of Management Proceedings, Academy of Management.(*為通訊作者)",2017,,,X,,Fabrice Lumineau,Basic_or_Discovery_Scholarship,E4:Papers in Academic conferences
123991.0,"The Origins of Complex Dispute Resolution Provisions, ' Academy of Management Best Paper Proceedings, Academy of Management.(*為通訊作者)",2017,期刊論文,Academy of Management Best Paper Proceedings,X,,,Basic_or_Discovery_Scholarship,E4:Papers in Academic conferences
123164.0,股東行動主義，公司表現和公司高管的關係(1/2),2019,,,X,,,Basic_or_Discovery_Scholarship,E15:Other(Please describe)其他(科技部學術型計畫 MOST Research Project)
123164.0,公司政治關聯與公司創新的探討(2/2),2019,,,X,,,Basic_or_Discovery_Scholarship,E15:Other(Please describe)其他(科技部學術型計畫 MOST Research Project)
123164.0,Who Dares to Say No? Independent Director Dissent in Chinese Public Corporations,2018,,,X,,Pei Sun/Michael Wither,Basic_or_Discovery_Scholarship,E4:Papers in Academic conferences
123164.0,What if Board Political Capital is Lost? Evidence from an Exogenous Regulatory Shock in China,2020,,,X,,Pei Sun,Basic_or_Discovery_Scholarship,E4:Papers in Academic conferences
123164.0,Political Connections and Corporate Innovation,2018,,,X,,,Basic_or_Discovery_Scholarship,E4:Papers in Academic conferences
123164.0,"Going along or going alone: How director dissents impact their career outcomes, ' Strategic Management Society Annual Conference, Strategic Management Society.(*為通訊作者)",2017,,,X,,,Basic_or_Discovery_Scholarship,E4:Papers in Academic conferences
123164.0,Acceleration and the role of accelerators in entrepreneurship,2018,,,X,,Laurens Vandeweghe,Basic_or_Discovery_Scholarship,E4:Papers in Academic conferences
126872.0,海榮國際公司 -- 供應鏈危機,2019,期刊論文,產業與管理論壇,O,于卓民，羅明琇,,Teaching_and_Learning_Scholarship,E6:Published Case Studies
111758.0,在有產能短缺的風險之下，具備創業精神之供應商該如何藉由下游買家可部分採購的原則來進行供貨,2016,,,X,,,Basic_or_Discovery_Scholarship,E15:Other(Please describe)其他(科技部學術型計畫 MOST Research Project)
111758.0,小農如何藉由創新的契作合約來脫離貧窮-合作買家依照小農生產數量來收購的新契約型態,2019,,,X,,,Basic_or_Discovery_Scholarship,E15:Other(Please describe)其他(科技部學術型計畫 MOST Research Project)
111758.0,Inventory renewal for a perishable product: Economies of scale and a ge‐dependent demand.,2020,期刊論文,Naval Research Logistics,,,amar sapra,Basic_or_Discovery_Scholarship,E1:Academic Research Articles
111758.0,"Are Purchased-triggered Donations Advantageous with Competition? Journal of the Operational Research Society 68(3): 237-252.
(SCI;SSCI;國科會推薦期刊)",2017,期刊論文,Journal of the Operational Research Society,O,,,Basic_or_Discovery_Scholarship,E1:Academic Research Articles
111758.0,Under what conditions can an application service firm with in-house computing benefit from cloudbursting?,2018,期刊論文,European Journal of Operational Research,O,,張瑋倫,Basic_or_Discovery_Scholarship,E1:Academic Research Articles
305021.0,A Multilevel Study of Brand-Specific Transformational Leadership: Employee and Customer Effects,2019,期刊論文,Journal of Brand Management,,,"Chiang, Hsu-Hsin,David McConville",Basic_or_Discovery_Scholarship,E1:Academic Research Articles
305021.0,Lean Production and Organizational Performance: Moderating Roles of Ability- and Motivation-Focused Human Resource Management,2019,期刊論文,the International Journal of Human Resources Development and Management,,,"Liao, Wan-Chun",Basic_or_Discovery_Scholarship,E1:Academic Research Articles
